{
  "schemaVersion": 1,
  "procedureId": "pcdf",
  "assetPath": "web/public/Posterior Cervical Decompression and Fusion (PCDF) Light.glb",
  "assetSha256": "d8d57774af3e59cdbfccf2636f6b4ab3f8934e0c48c542086684935cc3eedff9",
  "entities": [
    "c7 bone",
    "c6-c7 disk",
    "c3 bone",
    "c1 bone",
    "c2 bone",
    "c4 bone",
    "t6 bone",
    "c6 bone",
    "t1 bone",
    "t2 bone",
    "t3 bone",
    "t4 bone",
    "t5 bone",
    "cranium bone",
    "c2-c3 disk",
    "c3-c4 disk",
    "c4-c5 disk",
    "c5-c6 disk",
    "c7-t1 disk",
    "t1-t2 disk",
    "t2-t3 disk",
    "t3-t4 disk",
    "t4-t5 disk",
    "t5-t6 disk",
    "t6-t7 disk",
    "c5 bone",
    "ligament flavum",
    "rod 1",
    "screw cap 1",
    "screw saddle 1",
    "screw shaft 1",
    "screw cap 2",
    "screw saddle 2",
    "screw shaft 2",
    "screw cap 3",
    "screw saddle 3",
    "screw shaft 3",
    "screw cap 4",
    "screw saddle 4",
    "screw shaft 4",
    "screw saddle 5",
    "screw shaft 5",
    "screw cap 5",
    "screw shaft 8",
    "screw shaft 10",
    "screw shaft 9",
    "screw shaft 7",
    "screw shaft 6",
    "screw saddle 10",
    "screw saddle 9",
    "screw saddle 8",
    "screw saddle 7",
    "screw saddle 6",
    "screw cap 10",
    "screw cap 9",
    "screw cap 8",
    "screw cap 7",
    "screw cap 6",
    "rod 2",
    "c5 removed bone",
    "removed bone",
    "c5 nerve.001",
    "c5 nerve medulla",
    "removed ligament flavum.002",
    "posterior longitudinal ligament",
    "central nerve",
    "ligament flavum.002",
    "ligament flavum.003"
  ]
}
