{
  "schemaVersion": 1,
  "procedureId": "pcf",
  "assetPath": "web/public/Posterior Cervical Foraminotomy (PCF) Light.glb",
  "assetSha256": "f292255dafe7646ce48014f71555f05587ea0f0791a2dc9e4ff75d2fbd0ae403",
  "entities": [
    "t6-t7 disk",
    "t6 bone",
    "t5-t6 disk",
    "t5 bone",
    "t4-t5 disk",
    "t4 bone",
    "t3-t4 disk",
    "t3 bone",
    "t2-t3 disk",
    "t2 bone",
    "t1-t2 disk",
    "t1 bone",
    "cranial bone",
    "c7-t1 disk",
    "c7 bone",
    "c6-c7 disk",
    "c6 bone",
    "c5-c6 disk",
    "c3-c4 disk",
    "c3 bone",
    "c2-c3 disk",
    "c2 bone",
    "c1 bone",
    "c5 nerve medulla",
    "c5 nerve",
    "c5 bone",
    "c4 bone",
    "c4 bone removed",
    "c5 bone removed",
    "ligamentum flavum removed",
    "c4-c5 nucleus pulposus herniated",
    "c4-c5 disk",
    "c4-c5 nucleus pulposus normal",
    "posterior longitudinal ligament",
    "central nerve",
    "ligamentum flavum removed.001",
    "ligamentum flavum"
  ]
}
