{
  "schemaVersion": 1,
  "procedureId": "accf",
  "assetPath": "web/public/Anterior Cervical Corpectomy and Fusion (ACCF) Light.glb",
  "assetSha256": "ab13b22ffabca7153e456b13cdd751bfbbe964f17ef70905c44ea6de29fb9af6",
  "entities": [
    "t6-t7 disk",
    "t6 bone",
    "t5-t6 disk",
    "t5 bone",
    "t4-t5 disk",
    "t4 bone",
    "t3-t4 disk",
    "t3 bone",
    "t2-t3 disk",
    "t2 bone",
    "t1-t2 disk",
    "t1 bone",
    "ligamentum flavum",
    "cranium bone",
    "c7-t1 disk",
    "c7 bone",
    "c6-c7 disk",
    "c3-c4 disk",
    "c3 bone",
    "c2-c3 disk",
    "c2 bone",
    "c1 bone",
    "c4-c5 disk",
    "central nerve",
    "c5 nerve medulla",
    "c5 nerve",
    "c5-c6 disk",
    "c6 bone",
    "c5 bone removed solid",
    "c4 bone",
    "c6 bone removed",
    "c5 bone solid",
    "c4 bone removed",
    "screw 2",
    "screw 3",
    "screw 4",
    "screw 1",
    "plate",
    "vertebral body cage sheath",
    "vertebral body cage shaft",
    "c5 bone removed transparent",
    "c5 bone transparent",
    "c5-c6 nucleus pulposus",
    "c4-c5 nucleus pulposus",
    "posterior longitudinal ligament"
  ]
}
