{
  "schemaVersion": 1,
  "procedureId": "acdf",
  "assetPath": "web/public/Anterior Cervical Discectomy and Fusion (ACDF) Light.glb",
  "assetSha256": "15b1254d853a8ca7d96c27299b212bea531359cf1c45ddaab6fdd31a704b6426",
  "entities": [
    "t6-t7 disk",
    "t6 bone",
    "t5-t6 disk",
    "t5 bone",
    "t4-t5 disk",
    "t4 bone",
    "t3-t4 disk",
    "t3 bone",
    "t2-t3 disk",
    "t2 bone",
    "t1-t2 disk",
    "t1 bone",
    "cranial bone",
    "c7-t1 disk",
    "c7 bone",
    "c6-c7 disk",
    "c6 bone",
    "c5-c6 disk",
    "c4 bone",
    "c3-c4 disk",
    "c3 bone",
    "c2-c3 disk",
    "c2 bone",
    "c1 bone",
    "c5 bone",
    "screw 3",
    "screw 4",
    "screw 1",
    "screw 2",
    "plate 1",
    "plate 2",
    "c4-c5 disk",
    "c4-c5 nucleus pulposus",
    "c5 nerve medulla",
    "c5 nerve",
    "interbody spacer.004",
    "posterior longitudinal ligament",
    "ligamentum flavum",
    "central nerve"
  ]
}
